{
  "version": "1.0.0",
  "nodes": [
    {
      "id": "legal",
      "label": "Legal",
      "description": "Documents defining enforceable rights, obligations or legal proceedings.",
      "examples": [
        "Synthetic legal with primary purpose: Documents defining enforceable rights, obligations or legal proceedings."
      ],
      "signals": [
        "primary purpose: Documents defining enforceable rights, obligations or legal proceedings."
      ],
      "children": [
        {
          "id": "legal/agreements",
          "label": "Agreements",
          "description": "Mutual obligations between identified parties.",
          "examples": [
            "Synthetic agreements with content purpose: Mutual obligations between identified parties."
          ],
          "signals": [
            "content purpose: Mutual obligations between identified parties."
          ],
          "children": [
            {
              "id": "legal/agreements/contract",
              "label": "Contract",
              "description": "Binding terms for goods, services or rights between parties.",
              "examples": [
                "Synthetic contract with parties"
              ],
              "signals": [
                "parties",
                "consideration",
                "effective date",
                "obligations"
              ]
            },
            {
              "id": "legal/agreements/nda",
              "label": "Non-disclosure agreement",
              "description": "Limits disclosure and use of confidential information.",
              "examples": [
                "Synthetic non-disclosure agreement with confidential information"
              ],
              "signals": [
                "confidential information",
                "disclosing party",
                "exclusions",
                "survival"
              ],
              "children": [
                {
                  "id": "legal/agreements/nda/mutual",
                  "label": "Mutual NDA",
                  "description": "Both identified parties disclose confidential information and owe reciprocal confidentiality duties.",
                  "examples": [
                    "Synthetic mutual nda with reciprocal disclosure; each party is a discloser"
                  ],
                  "signals": [
                    "reciprocal disclosure; each party is a discloser"
                  ]
                },
                {
                  "id": "legal/agreements/nda/unilateral",
                  "label": "Unilateral NDA",
                  "description": "One identified party discloses and the other alone owes confidentiality duties.",
                  "examples": [
                    "Synthetic unilateral nda with disclosing party; receiving party has confidentiality duty"
                  ],
                  "signals": [
                    "disclosing party; receiving party has confidentiality duty"
                  ]
                },
                {
                  "id": "legal/agreements/nda/other",
                  "label": "Other",
                  "description": "Evidence belongs under legal/agreements/nda but no named sibling accurately describes its primary purpose; select only after considering named alternatives.",
                  "examples": [
                    "Synthetic other with primary purpose outside the named sibling definitions"
                  ],
                  "signals": [
                    "primary purpose outside the named sibling definitions"
                  ]
                }
              ]
            },
            {
              "id": "legal/agreements/lease",
              "label": "Lease",
              "description": "Grants possession or use of property for rent and a term.",
              "examples": [
                "Synthetic lease with lessor"
              ],
              "signals": [
                "lessor",
                "lessee",
                "rent",
                "premises"
              ]
            },
            {
              "id": "legal/agreements/other",
              "label": "Other",
              "description": "Evidence belongs under legal/agreements but no named sibling accurately describes its primary purpose; select only after considering named alternatives.",
              "examples": [
                "Synthetic other with primary purpose outside the named sibling definitions"
              ],
              "signals": [
                "primary purpose outside the named sibling definitions"
              ]
            }
          ]
        },
        {
          "id": "legal/litigation",
          "label": "Litigation",
          "description": "Materials filed or exchanged in a legal dispute.",
          "examples": [
            "Synthetic litigation with content purpose: Materials filed or exchanged in a legal dispute."
          ],
          "signals": [
            "content purpose: Materials filed or exchanged in a legal dispute."
          ],
          "children": [
            {
              "id": "legal/litigation/pleading",
              "label": "Pleading",
              "description": "Formal claim or defense filed with a court.",
              "examples": [
                "Synthetic pleading with court caption"
              ],
              "signals": [
                "court caption",
                "plaintiff",
                "relief sought",
                "case number"
              ]
            },
            {
              "id": "legal/litigation/judgment",
              "label": "Judgment",
              "description": "Court determination of rights or liability.",
              "examples": [
                "Synthetic judgment with ordered adjudged"
              ],
              "signals": [
                "ordered adjudged",
                "judge",
                "disposition",
                "docket"
              ]
            },
            {
              "id": "legal/litigation/legal_opinion",
              "label": "Legal opinion",
              "description": "Counsel analysis of a legal question for a client.",
              "examples": [
                "Synthetic legal opinion with legal question"
              ],
              "signals": [
                "legal question",
                "counsel",
                "cited authority",
                "conclusion"
              ]
            },
            {
              "id": "legal/litigation/other",
              "label": "Other",
              "description": "Evidence belongs under legal/litigation but no named sibling accurately describes its primary purpose; select only after considering named alternatives.",
              "examples": [
                "Synthetic other with primary purpose outside the named sibling definitions"
              ],
              "signals": [
                "primary purpose outside the named sibling definitions"
              ]
            }
          ]
        },
        {
          "id": "legal/corporate",
          "label": "Corporate governance",
          "description": "Legal records of corporate authority and ownership.",
          "examples": [
            "Synthetic corporate governance with content purpose: Legal records of corporate authority and ownership."
          ],
          "signals": [
            "content purpose: Legal records of corporate authority and ownership."
          ],
          "children": [
            {
              "id": "legal/corporate/board_resolution",
              "label": "Board resolution",
              "description": "Records a board's formal authorization or decision.",
              "examples": [
                "Synthetic board resolution with resolved"
              ],
              "signals": [
                "resolved",
                "directors",
                "authorization",
                "meeting date"
              ]
            },
            {
              "id": "legal/corporate/articles",
              "label": "Articles of incorporation",
              "description": "Constitutes a legal entity and its organizational powers.",
              "examples": [
                "Synthetic articles of incorporation with incorporator"
              ],
              "signals": [
                "incorporator",
                "registered office",
                "share classes"
              ]
            },
            {
              "id": "legal/corporate/power_of_attorney",
              "label": "Power of attorney",
              "description": "Authorizes another person to act legally for a principal.",
              "examples": [
                "Synthetic power of attorney with principal"
              ],
              "signals": [
                "principal",
                "attorney-in-fact",
                "delegated powers"
              ]
            },
            {
              "id": "legal/corporate/other",
              "label": "Other",
              "description": "Evidence belongs under legal/corporate but no named sibling accurately describes its primary purpose; select only after considering named alternatives.",
              "examples": [
                "Synthetic other with primary purpose outside the named sibling definitions"
              ],
              "signals": [
                "primary purpose outside the named sibling definitions"
              ]
            }
          ]
        },
        {
          "id": "legal/other",
          "label": "Other",
          "description": "Evidence belongs under legal but no named sibling accurately describes its primary purpose; select only after considering named alternatives.",
          "examples": [
            "Synthetic other with primary purpose outside the named sibling definitions"
          ],
          "signals": [
            "primary purpose outside the named sibling definitions"
          ],
          "children": [